{
  "name": "Cape Town",
  "category": "city",
  "author": "Jean Luc Iradukunda",
  "background": "#1a1510",
  "ui_accent": "#f0c57e",
  "ground_colors": ["#c4a878", "#b89868", "#d4b888"],
  "ground_stroke": "#8a7050",
  "entities": [
    { "type": "person", "count": 6, "speed": 0.012 },
    { "type": "pigeon", "count": 3, "speed": 0.015 }
  ],
  "particles": null,
  "landmarks": [
    { "sprite": "level-4-h.png", "name": "V&A Clock Tower" },
    { "sprite": "level-4-b.png", "name": "Cape Town Stadium" },
    { "sprite": "level-4-c.png", "name": "Portside Tower" }
  ]
}
